{"bundle_sha256":"sha256:98659630f3e1238d2684c2b4cba728334f4bdace67ff033652676d9d505caf33","cases":[{"case_classes":["canonical_envelope","capture_gap_derivation"],"case_id":"canonical_envelopes/reference-settled","result_base64":"eyJhY3RvciI6eyJ0eXBlIjoic3lzdGVtIn0sImNvcnJlbGF0aW9uIjp7InJlcXVlc3RfcmVmIjoicmVxX2ZlZWRfdjFfc2V0dGxlZCJ9LCJkYXRhX3BvbGljeSI6eyJwYXlsb2FkX2NhcHR1cmVfbW9kZSI6Im1ldGFkYXRhX29ubHkiLCJyYXdfcGF5bG9hZF9wcmVzZW50IjpmYWxzZX0sImV2ZW50X2lkIjoicmVxX2ZlZWRfdjFfc2V0dGxlZCIsImV2ZW50X3R5cGUiOiJtb2RlbC5yZXF1ZXN0LmNvbXBsZXRlZCIsImlkZW50aXR5Ijp7ImlkZW1wb3RlbmN5X2tleSI6InNoYTI1NjpjMjgyMmYwZDk0MGMwMWRlNzdlMmUwNmFmMWE1ZjZlMWZkMTBmYzY2MjY5YmUyMGZjZWIwOTM5MTUwYzE3YjJlIiwic291cmNlX3JldmlzaW9uIjoiMSJ9LCJpbnRlZ3JpdHkiOnsic291cmNlX2hhc2giOiJzaGEyNTY6NWU5ZWRhMGEyNjMwZDUyYzU1ODlkMzhiOGVjNDgwNjA0YzQ3YzJjYzc3MzkxYjc1YTU3YjJhMTU5ZGI2ZGQyNyJ9LCJwYXlsb2FkIjp7ImNhcHR1cmVfZ2FwcyI6W3siYWZmZWN0ZWRfY2xhaW0iOiJjYWxsX2xvZyIsImNvcnJlbGF0aW9uIjp7InJlcXVlc3RfcmVmIjoicmVxX2ZlZWRfdjFfc2V0dGxlZCJ9LCJmaWVsZF9wcm92ZW5hbmNlIjp7ImFmZmVjdGVkX2NsYWltIjoiZGlyZWN0IiwiY29ycmVsYXRpb24iOiJkZXJpdmVkIiwiZ2FwX2lkIjoiZGVyaXZlZCIsImdhcF90eXBlIjoiZGVjbGFyZWQiLCJvYnNlcnZlZF9hdCI6ImRlcml2ZWQiLCJwYXJlbnRfZXZlbnRfaWQiOiJkZXJpdmVkIiwicGF5bG9hZF9jYXB0dXJlX21vZGUiOiJkZWNsYXJlZCIsInJlYXNvbl9jb2RlIjoiZGlyZWN0Iiwic2NvcGUiOiJkZXJpdmVkIiwic2V2ZXJpdHkiOiJkZWNsYXJlZCJ9LCJnYXBfaWQiOiJyZXFfZmVlZF92MV9zZXR0bGVkOmdhcDpjYWxsX2xvZyIsImdhcF90eXBlIjoibm90X2F2YWlsYWJsZV9mcm9tX3NvdXJjZSIsIm9ic2VydmVkX2F0IjoiMjAyNi0wNy0yNVQwNDowNTowNi4wMDAwMDBaIiwicGFyZW50X2V2ZW50X2lkIjoicmVxX2ZlZWRfdjFfc2V0dGxlZCIsInBheWxvYWRfY2FwdHVyZV9tb2RlIjoibm9uZSIsInJlYXNvbl9jb2RlIjoibm90X2F2YWlsYWJsZV9hdF9iaWxsaW5nX3Rlcm1pbmFsIiwic2NvcGUiOnsib3JnX3JlZiI6IjEwMSIsInByb2plY3RfcmVmIjoiMjAyIn0sInNldmVyaXR5Ijoid2FybmluZyJ9LHsiYWZmZWN0ZWRfY2xhaW0iOiJjbGllbnRfaXBfcHJlc2VuY2UiLCJjb3JyZWxhdGlvbiI6eyJyZXF1ZXN0X3JlZiI6InJlcV9mZWVkX3YxX3NldHRsZWQifSwiZmllbGRfcHJvdmVuYW5jZSI6eyJhZmZlY3RlZF9jbGFpbSI6ImRpcmVjdCIsImNvcnJlbGF0aW9uIjoiZGVyaXZlZCIsImdhcF9pZCI6ImRlcml2ZWQiLCJnYXBfdHlwZSI6ImRlY2xhcmVkIiwib2JzZXJ2ZWRfYXQiOiJkZXJpdmVkIiwicGFyZW50X2V2ZW50X2lkIjoiZGVyaXZlZCIsInBheWxvYWRfY2FwdHVyZV9tb2RlIjoiZGVjbGFyZWQiLCJyZWFzb25fY29kZSI6ImRpcmVjdCIsInNjb3BlIjoiZGVyaXZlZCIsInNldmVyaXR5IjoiZGVjbGFyZWQifSwiZ2FwX2lkIjoicmVxX2ZlZWRfdjFfc2V0dGxlZDpnYXA6Y2xpZW50X2lwX3ByZXNlbmNlIiwiZ2FwX3R5cGUiOiJub3RfYXZhaWxhYmxlX2Zyb21fc291cmNlIiwib2JzZXJ2ZWRfYXQiOiIyMDI2LTA3LTI1VDA0OjA1OjA2LjAwMDAwMFoiLCJwYXJlbnRfZXZlbnRfaWQiOiJyZXFfZmVlZF92MV9zZXR0bGVkIiwicGF5bG9hZF9jYXB0dXJlX21vZGUiOiJub25lIiwicmVhc29uX2NvZGUiOiJub3RfYXZhaWxhYmxlX2F0X2JpbGxpbmdfdGVybWluYWwiLCJzY29wZSI6eyJvcmdfcmVmIjoiMTAxIiwicHJvamVjdF9yZWYiOiIyMDIifSwic2V2ZXJpdHkiOiJ3YXJuaW5nIn0seyJhZmZlY3RlZF9jbGFpbSI6InJlcXVlc3RfdHJhY2UiLCJjb3JyZWxhdGlvbiI6eyJyZXF1ZXN0X3JlZiI6InJlcV9mZWVkX3YxX3NldHRsZWQifSwiZmllbGRfcHJvdmVuYW5jZSI6eyJhZmZlY3RlZF9jbGFpbSI6ImRpcmVjdCIsImNvcnJlbGF0aW9uIjoiZGVyaXZlZCIsImdhcF9pZCI6ImRlcml2ZWQiLCJnYXBfdHlwZSI6ImRlY2xhcmVkIiwib2JzZXJ2ZWRfYXQiOiJkZXJpdmVkIiwicGFyZW50X2V2ZW50X2lkIjoiZGVyaXZlZCIsInBheWxvYWRfY2FwdHVyZV9tb2RlIjoiZGVjbGFyZWQiLCJyZWFzb25fY29kZSI6ImRpcmVjdCIsInNjb3BlIjoiZGVyaXZlZCIsInNldmVyaXR5IjoiZGVjbGFyZWQifSwiZ2FwX2lkIjoicmVxX2ZlZWRfdjFfc2V0dGxlZDpnYXA6cmVxdWVzdF90cmFjZSIsImdhcF90eXBlIjoibm90X2F2YWlsYWJsZV9mcm9tX3NvdXJjZSIsIm9ic2VydmVkX2F0IjoiMjAyNi0wNy0yNVQwNDowNTowNi4wMDAwMDBaIiwicGFyZW50X2V2ZW50X2lkIjoicmVxX2ZlZWRfdjFfc2V0dGxlZCIsInBheWxvYWRfY2FwdHVyZV9tb2RlIjoibm9uZSIsInJlYXNvbl9jb2RlIjoibm90X2F2YWlsYWJsZV9hdF9iaWxsaW5nX3Rlcm1pbmFsIiwic2NvcGUiOnsib3JnX3JlZiI6IjEwMSIsInByb2plY3RfcmVmIjoiMjAyIn0sInNldmVyaXR5Ijoid2FybmluZyJ9LHsiYWZmZWN0ZWRfY2xhaW0iOiJ1cHN0cmVhbV9lcnJvcl9wcmVzZW5jZSIsImNvcnJlbGF0aW9uIjp7InJlcXVlc3RfcmVmIjoicmVxX2ZlZWRfdjFfc2V0dGxlZCJ9LCJmaWVsZF9wcm92ZW5hbmNlIjp7ImFmZmVjdGVkX2NsYWltIjoiZGlyZWN0IiwiY29ycmVsYXRpb24iOiJkZXJpdmVkIiwiZ2FwX2lkIjoiZGVyaXZlZCIsImdhcF90eXBlIjoiZGVjbGFyZWQiLCJvYnNlcnZlZF9hdCI6ImRlcml2ZWQiLCJwYXJlbnRfZXZlbnRfaWQiOiJkZXJpdmVkIiwicGF5bG9hZF9jYXB0dXJlX21vZGUiOiJkZWNsYXJlZCIsInJlYXNvbl9jb2RlIjoiZGlyZWN0Iiwic2NvcGUiOiJkZXJpdmVkIiwic2V2ZXJpdHkiOiJkZWNsYXJlZCJ9LCJnYXBfaWQiOiJyZXFfZmVlZF92MV9zZXR0bGVkOmdhcDp1cHN0cmVhbV9lcnJvcl9wcmVzZW5jZSIsImdhcF90eXBlIjoibm90X2F2YWlsYWJsZV9mcm9tX3NvdXJjZSIsIm9ic2VydmVkX2F0IjoiMjAyNi0wNy0yNVQwNDowNTowNi4wMDAwMDBaIiwicGFyZW50X2V2ZW50X2lkIjoicmVxX2ZlZWRfdjFfc2V0dGxlZCIsInBheWxvYWRfY2FwdHVyZV9tb2RlIjoibm9uZSIsInJlYXNvbl9jb2RlIjoibm90X2F2YWlsYWJsZV9hdF9iaWxsaW5nX3Rlcm1pbmFsIiwic2NvcGUiOnsib3JnX3JlZiI6IjEwMSIsInByb2plY3RfcmVmIjoiMjAyIn0sInNldmVyaXR5Ijoid2FybmluZyJ9XSwibW9uZXkiOnsiYW1vdW50X3NjYWxlIjoxMDAwMDAwLCJjYWxjdWxhdGVkX2Nvc3RfbWljcm9zIjoiMTciLCJjaGFyZ2VkX2Nvc3RfbWljcm9zIjoiMTciLCJjdXJyZW5jeSI6IkNOWSIsInByaWNpbmdfdmVyc2lvbiI6InByaWNpbmctdjEiLCJzY2hlbWEiOiJtaWNyby1jbnkudjEifSwidGVybWluYWwiOnsic3RhdHVzIjoic2V0dGxlZCJ9LCJ0aW1lbGluZV9jb21wbGV0ZSI6dHJ1ZSwidXNhZ2UiOnsiYXV0aG9yaXR5IjoicHJvdmlkZXIiLCJjYWNoZV9jcmVhdGlvbl90b2tlbnMiOiIxIiwiY2FjaGVfcmVhZF90b2tlbnMiOiIyIiwiY2FjaGVfdXNhZ2Vfc2NoZW1hIjoiY2FjaGUudjEiLCJjYWNoZV91c2FnZV9zdGF0dXMiOiJyZXBvcnRlZCIsImNvbXBsZXRpb25fdG9rZW5zIjoiMyIsImNvbnRyYWN0X3ZlcnNpb24iOiJ1c2FnZS52MSIsImZpbmFsaXR5IjoiZmluYWwiLCJtb2RlbCI6InN5bnRoZXRpYy1tb2RlbCIsInByb21wdF90b2tlbnMiOiI4IiwicHVycG9zZSI6ImJpbGxpbmciLCJzb3VyY2UiOiJwcm92aWRlciIsInVuY2FjaGVkX3Byb21wdF90b2tlbnMiOiI1In19LCJwcm9kdWNlciI6eyJjb25uZWN0b3JfaWQiOiJmb2lnZW50LnVuaXJvdXRlci5jb21wbGV0ZWQtZXhlY3V0aW9uIiwiY29ubmVjdG9yX3ZlcnNpb24iOiIxLjAuMCIsImluc3RhbmNlIjoidW5pcm91dGVyLWRldmVsb3BtZW50IiwicHJvZHVjdCI6InVuaXJvdXRlciJ9LCJwcm92ZW5hbmNlIjp7ImFkYXB0ZXJfZmlkZWxpdHkiOiJGMiIsImZpZWxkX2dyb3VwcyI6eyJhY3RvciI6ImRlY2xhcmVkIiwiY29ycmVsYXRpb24iOiJkaXJlY3QiLCJkYXRhX3BvbGljeSI6ImRlY2xhcmVkIiwiaWRlbnRpdHkiOiJkaXJlY3QiLCJwYXlsb2FkLmNhcHR1cmVfZ2FwcyI6ImRpcmVjdCIsInBheWxvYWQubW9uZXkiOiJkaXJlY3QiLCJwYXlsb2FkLnRlcm1pbmFsIjoiZGlyZWN0IiwicGF5bG9hZC50aW1lbGluZV9jb21wbGV0ZSI6ImRpcmVjdCIsInBheWxvYWQudXNhZ2UiOiJkaXJlY3QiLCJzY29wZSI6ImRpcmVjdCIsInN1YmplY3QiOiJkZXJpdmVkIiwidGltZS5vY2N1cnJlZF9hdCI6ImRlcml2ZWQiLCJ0aW1lLnRlcm1pbmFsX2F0IjoiZGlyZWN0In19LCJzY2hlbWFfcmVmIjoiZm9pZ2VudDovL2V2ZW50cy9tb2RlbC9yZXF1ZXN0LWNvbXBsZXRlZC92MSIsInNjaGVtYV92ZXJzaW9uIjoiMSIsInNjb3BlIjp7Im9yZ19yZWYiOiIxMDEiLCJwcm9qZWN0X3JlZiI6IjIwMiJ9LCJzcGVjX3ZlcnNpb24iOiJmb2lnZW50LmV2ZW50LWVudmVsb3BlLnYxIiwic3ViamVjdCI6eyJyZWYiOiJyZXFfZmVlZF92MV9zZXR0bGVkIiwidHlwZSI6InJlcXVlc3QifSwidGltZSI6eyJvY2N1cnJlZF9hdCI6IjIwMjYtMDctMjVUMDQ6MDU6MDYuMDAwMDAwWiIsInRlcm1pbmFsX2F0IjoiMjAyNi0wNy0yNVQwNDowNTowNi4wMDAwMDBaIn19","result_kind":"bytes","result_sha256":"sha256:0d11f98f981427b7bcf175e82294511ca42981c0ecea8e02f841c3777743d1d2","status":"pass"},{"case_classes":["canonical_envelope","capture_gap_derivation"],"case_id":"canonical_envelopes/reference-cancelled","result_base64":"eyJhY3RvciI6eyJ0eXBlIjoic3lzdGVtIn0sImNvcnJlbGF0aW9uIjp7InJlcXVlc3RfcmVmIjoicmVxX2ZlZWRfdjFfY2FuY2VsbGVkIn0sImRhdGFfcG9saWN5Ijp7InBheWxvYWRfY2FwdHVyZV9tb2RlIjoibWV0YWRhdGFfb25seSIsInJhd19wYXlsb2FkX3ByZXNlbnQiOmZhbHNlfSwiZXZlbnRfaWQiOiJyZXFfZmVlZF92MV9jYW5jZWxsZWQiLCJldmVudF90eXBlIjoibW9kZWwucmVxdWVzdC5jb21wbGV0ZWQiLCJpZGVudGl0eSI6eyJpZGVtcG90ZW5jeV9rZXkiOiJzaGEyNTY6ZDM0MmE1NjBhZGU1NThlZGM1NTdmMmNkNjQ1YTUyNjE3ODk1ODU0MGEwMTJjZWFiZTljYTcwNDdlOTE2Nzk2YyIsInNvdXJjZV9yZXZpc2lvbiI6IjEifSwiaW50ZWdyaXR5Ijp7InNvdXJjZV9oYXNoIjoic2hhMjU2OjMxY2JmZWIyMzk2OGMwN2QxNThiNTkxYzI4ZWZiM2RkNDBjZmZiYTFmZDZkMWZkNDIwMmY0M2Q2M2JmZTlmMmQifSwicGF5bG9hZCI6eyJjYXB0dXJlX2dhcHMiOlt7ImFmZmVjdGVkX2NsYWltIjoiY2FsbF9sb2ciLCJjb3JyZWxhdGlvbiI6eyJyZXF1ZXN0X3JlZiI6InJlcV9mZWVkX3YxX2NhbmNlbGxlZCJ9LCJmaWVsZF9wcm92ZW5hbmNlIjp7ImFmZmVjdGVkX2NsYWltIjoiZGlyZWN0IiwiY29ycmVsYXRpb24iOiJkZXJpdmVkIiwiZ2FwX2lkIjoiZGVyaXZlZCIsImdhcF90eXBlIjoiZGVjbGFyZWQiLCJvYnNlcnZlZF9hdCI6ImRlcml2ZWQiLCJwYXJlbnRfZXZlbnRfaWQiOiJkZXJpdmVkIiwicGF5bG9hZF9jYXB0dXJlX21vZGUiOiJkZWNsYXJlZCIsInJlYXNvbl9jb2RlIjoiZGlyZWN0Iiwic2NvcGUiOiJkZXJpdmVkIiwic2V2ZXJpdHkiOiJkZWNsYXJlZCJ9LCJnYXBfaWQiOiJyZXFfZmVlZF92MV9jYW5jZWxsZWQ6Z2FwOmNhbGxfbG9nIiwiZ2FwX3R5cGUiOiJub3RfYXZhaWxhYmxlX2Zyb21fc291cmNlIiwib2JzZXJ2ZWRfYXQiOiIyMDI2LTA3LTI1VDA0OjA2OjA3LjAwMDAwMFoiLCJwYXJlbnRfZXZlbnRfaWQiOiJyZXFfZmVlZF92MV9jYW5jZWxsZWQiLCJwYXlsb2FkX2NhcHR1cmVfbW9kZSI6Im5vbmUiLCJyZWFzb25fY29kZSI6Im5vdF9hdmFpbGFibGVfYXRfYmlsbGluZ190ZXJtaW5hbCIsInNjb3BlIjp7Im9yZ19yZWYiOiIxMDEiLCJwcm9qZWN0X3JlZiI6IjIwMiJ9LCJzZXZlcml0eSI6Indhcm5pbmcifSx7ImFmZmVjdGVkX2NsYWltIjoiY2xpZW50X2lwX3ByZXNlbmNlIiwiY29ycmVsYXRpb24iOnsicmVxdWVzdF9yZWYiOiJyZXFfZmVlZF92MV9jYW5jZWxsZWQifSwiZmllbGRfcHJvdmVuYW5jZSI6eyJhZmZlY3RlZF9jbGFpbSI6ImRpcmVjdCIsImNvcnJlbGF0aW9uIjoiZGVyaXZlZCIsImdhcF9pZCI6ImRlcml2ZWQiLCJnYXBfdHlwZSI6ImRlY2xhcmVkIiwib2JzZXJ2ZWRfYXQiOiJkZXJpdmVkIiwicGFyZW50X2V2ZW50X2lkIjoiZGVyaXZlZCIsInBheWxvYWRfY2FwdHVyZV9tb2RlIjoiZGVjbGFyZWQiLCJyZWFzb25fY29kZSI6ImRpcmVjdCIsInNjb3BlIjoiZGVyaXZlZCIsInNldmVyaXR5IjoiZGVjbGFyZWQifSwiZ2FwX2lkIjoicmVxX2ZlZWRfdjFfY2FuY2VsbGVkOmdhcDpjbGllbnRfaXBfcHJlc2VuY2UiLCJnYXBfdHlwZSI6Im5vdF9hdmFpbGFibGVfZnJvbV9zb3VyY2UiLCJvYnNlcnZlZF9hdCI6IjIwMjYtMDctMjVUMDQ6MDY6MDcuMDAwMDAwWiIsInBhcmVudF9ldmVudF9pZCI6InJlcV9mZWVkX3YxX2NhbmNlbGxlZCIsInBheWxvYWRfY2FwdHVyZV9tb2RlIjoibm9uZSIsInJlYXNvbl9jb2RlIjoibm90X2F2YWlsYWJsZV9hdF9iaWxsaW5nX3Rlcm1pbmFsIiwic2NvcGUiOnsib3JnX3JlZiI6IjEwMSIsInByb2plY3RfcmVmIjoiMjAyIn0sInNldmVyaXR5Ijoid2FybmluZyJ9LHsiYWZmZWN0ZWRfY2xhaW0iOiJyZXF1ZXN0X3RyYWNlIiwiY29ycmVsYXRpb24iOnsicmVxdWVzdF9yZWYiOiJyZXFfZmVlZF92MV9jYW5jZWxsZWQifSwiZmllbGRfcHJvdmVuYW5jZSI6eyJhZmZlY3RlZF9jbGFpbSI6ImRpcmVjdCIsImNvcnJlbGF0aW9uIjoiZGVyaXZlZCIsImdhcF9pZCI6ImRlcml2ZWQiLCJnYXBfdHlwZSI6ImRlY2xhcmVkIiwib2JzZXJ2ZWRfYXQiOiJkZXJpdmVkIiwicGFyZW50X2V2ZW50X2lkIjoiZGVyaXZlZCIsInBheWxvYWRfY2FwdHVyZV9tb2RlIjoiZGVjbGFyZWQiLCJyZWFzb25fY29kZSI6ImRpcmVjdCIsInNjb3BlIjoiZGVyaXZlZCIsInNldmVyaXR5IjoiZGVjbGFyZWQifSwiZ2FwX2lkIjoicmVxX2ZlZWRfdjFfY2FuY2VsbGVkOmdhcDpyZXF1ZXN0X3RyYWNlIiwiZ2FwX3R5cGUiOiJub3RfYXZhaWxhYmxlX2Zyb21fc291cmNlIiwib2JzZXJ2ZWRfYXQiOiIyMDI2LTA3LTI1VDA0OjA2OjA3LjAwMDAwMFoiLCJwYXJlbnRfZXZlbnRfaWQiOiJyZXFfZmVlZF92MV9jYW5jZWxsZWQiLCJwYXlsb2FkX2NhcHR1cmVfbW9kZSI6Im5vbmUiLCJyZWFzb25fY29kZSI6Im5vdF9hdmFpbGFibGVfYXRfYmlsbGluZ190ZXJtaW5hbCIsInNjb3BlIjp7Im9yZ19yZWYiOiIxMDEiLCJwcm9qZWN0X3JlZiI6IjIwMiJ9LCJzZXZlcml0eSI6Indhcm5pbmcifSx7ImFmZmVjdGVkX2NsYWltIjoid